{
  "architecture_allowed_paths": [
    "docs/architecture/"
  ],
  "authoritative_documents": [
    "BACKLOG.md",
    "docs/architecture/requirements-index.md",
    "docs/architecture/architecture.md",
    "docs/architecture/implementation-plan.md"
  ],
  "bootstrap_ticket": "T00",
  "capabilities": {
    "repository_push": false,
    "self_modification": false,
    "user_requested_modification": false
  },
  "diagnostic": {
    "completed_same_ticket_recoveries": 2,
    "max_adr_documents": 3,
    "max_artifact_bytes": 16000,
    "max_check_logs_per_run": 2,
    "max_history_entries": 80,
    "max_recent_runs": 4,
    "max_ticket_context_bytes": 24000
  },
  "evidence_check_commands": {},
  "expected_branch": "main",
  "host_verification_capabilities": {},
  "human_evidence_gates": {},
  "implementation_forbidden_paths": [
    "BACKLOG.md",
    "docs/architecture/",
    "dev-supervisor.json",
    "dev"
  ],
  "implementation_plan": "docs/architecture/implementation-plan.md",
  "improvement": {
    "max_description_characters": 2000,
    "max_tickets": 1,
    "successor_directory": ".dev-supervisor/successors"
  },
  "initial_completed_tickets": [],
  "milestones": [
    {
      "after_ticket": "T12",
      "before_ticket": "T99",
      "message": "Qualification is complete. Do not release this gate under Supervisor 1.x; review cutover and activate one immutable Supervisor 2.0 controller generation.",
      "name": "Supervisor 2.0 cutover approval"
    }
  ],
  "model_watchdog": {
    "hard_timeout_seconds": 5400,
    "terminate_grace_seconds": 10,
    "warning_seconds": 2700
  },
  "models": {
    "architecture": {
      "model": "gpt-5.6-sol",
      "reasoning_effort": "high"
    },
    "diagnostic": {
      "model": "gpt-5.6-sol",
      "reasoning_effort": "high"
    },
    "implementation": {
      "model": "gpt-5.6-terra",
      "reasoning_effort": "medium"
    },
    "supervisor_repair": {
      "model": "gpt-5.6-sol",
      "reasoning_effort": "high"
    }
  },
  "periodic_checkpoint": {
    "max_active_runtime_seconds": 7200,
    "max_completed_tickets": 2,
    "max_model_invocations": 3
  },
  "quota": {
    "account_id": "manual-observation",
    "high_reuse_invocation_count": 1,
    "high_reuse_ttl_minutes": 30,
    "provider": "manual",
    "roles": {
      "architecture": {
        "five_hour": {
          "high": {
            "maximum_percent": 100,
            "minimum_percent": 60
          },
          "low": {
            "maximum_percent": 29,
            "minimum_percent": 0
          },
          "medium": {
            "maximum_percent": 59,
            "minimum_percent": 30
          }
        },
        "weekly": {
          "high": {
            "maximum_percent": 100,
            "minimum_percent": 50
          },
          "low": {
            "maximum_percent": 19,
            "minimum_percent": 0
          },
          "medium": {
            "maximum_percent": 49,
            "minimum_percent": 20
          }
        }
      },
      "diagnostic": {
        "five_hour": {
          "high": {
            "maximum_percent": 100,
            "minimum_percent": 60
          },
          "low": {
            "maximum_percent": 29,
            "minimum_percent": 0
          },
          "medium": {
            "maximum_percent": 59,
            "minimum_percent": 30
          }
        },
        "weekly": {
          "high": {
            "maximum_percent": 100,
            "minimum_percent": 50
          },
          "low": {
            "maximum_percent": 19,
            "minimum_percent": 0
          },
          "medium": {
            "maximum_percent": 49,
            "minimum_percent": 20
          }
        }
      },
      "implementation": {
        "five_hour": {
          "high": {
            "maximum_percent": 100,
            "minimum_percent": 50
          },
          "low": {
            "maximum_percent": 19,
            "minimum_percent": 0
          },
          "medium": {
            "maximum_percent": 49,
            "minimum_percent": 20
          }
        },
        "weekly": {
          "high": {
            "maximum_percent": 100,
            "minimum_percent": 45
          },
          "low": {
            "maximum_percent": 14,
            "minimum_percent": 0
          },
          "medium": {
            "maximum_percent": 44,
            "minimum_percent": 15
          }
        }
      },
      "supervisor_repair": {
        "five_hour": {
          "high": {
            "maximum_percent": 100,
            "minimum_percent": 60
          },
          "low": {
            "maximum_percent": 29,
            "minimum_percent": 0
          },
          "medium": {
            "maximum_percent": 59,
            "minimum_percent": 30
          }
        },
        "weekly": {
          "high": {
            "maximum_percent": 100,
            "minimum_percent": 50
          },
          "low": {
            "maximum_percent": 19,
            "minimum_percent": 0
          },
          "medium": {
            "maximum_percent": 49,
            "minimum_percent": 20
          }
        }
      }
    }
  },
  "supervisor_control_paths": [
    "dev",
    "dev-supervisor.json"
  ],
  "supervisor_repair_repository": "external",
  "supervisor_repair_verification_commands": [],
  "ticket_verification_commands": {},
  "verification_commands": [
    {
      "command": [
        "python3",
        "-m",
        "unittest",
        "discover",
        "-s",
        "tests",
        "-v"
      ],
      "name": "Supervisor unit tests"
    },
    {
      "command": [
        "python3",
        "-m",
        "py_compile",
        "supervisor.py"
      ],
      "name": "Supervisor Python compilation"
    },
    {
      "command": [
        "git",
        "diff",
        "--check"
      ],
      "name": "Git diff check"
    }
  ],
  "version": 3
}
